player1,guard_01,"{'fact': 'King Alden the Just governs the city with wisdom and strength.', 'emotion': 'respectful', 'slot': 'king'}",2025-10-30 18:20:11
player1,guard_01,"{'fact': 'King Alden the Just governs the city with wisdom and strength.', 'emotion': 'respectful', 'slot': 'ruler'}",2025-10-30 18:20:24
player1,guard_01,"{'fact': 'The NPC is a city guard committed to ensuring safety.', 'emotion': 'duty', 'slot': 'occupation'}",2025-10-30 18:20:36
player1,guard_01,King Alden the Just governs the city with wisdom and strength.,2025-10-30 18:23:04
player1,guard_01,"King Alden the Just governs the city with wisdom and strength, and his reign is associated with peace.",2025-10-30 18:23:18
player1,guard_01,The NPC remains vigilant due to a confrontation near the market.,2025-10-30 18:23:34
