speaker,text,emotion,timestamp
player,"Hello, how are you feeling today?",unknown,2025-10-31 10:32:53
NPC,Not bad at all. I'm simply taking in the atmosphere of the town today. Have you come across any good music lately?,serious,2025-10-31 10:32:53
player,That's good to hear. What have you been working on lately?,unknown,2025-10-31 10:33:04
NPC,"Same old. Haulin' feed, mendin' nets. Feels like I'm chasin' the sun sometimes.",neutral,2025-10-31 10:33:04
player,Sounds interesting! I've been practicing some new songs myself.,unknown,2025-10-31 10:33:16
NPC,I would appreciate hearing about what you've been working on. Collaborating with someone else can make the process of creating music significantly more engaging and rewarding.,serious,2025-10-31 10:33:16
player,Maybe we could collaborate sometime? I could use some musical inspiration.,unknown,2025-10-31 10:33:27
NPC,"I don't know much about music. I stick to shovels and soil. Not much inspiration there, I reckon.",neutral,2025-10-31 10:33:27
player,"Hello, how are you feeling today?",unknown,2025-10-31 10:43:59
NPC,"Not particularly eventful, just going along with the day. A new melody has been on my mind, and I look forward to experimenting with it later.",serious,2025-10-31 10:43:59
player,"Not particularly eventful, just going along with the day. A new melody has been on my mind, and I look forward to experimenting with it later.",unknown,2025-10-31 10:44:12
NPC,Melodies will not plow the fields or repair the fences. Focus on your work and remain diligent.,neutral,2025-10-31 10:44:12
player,Melodies will not plow the fields or repair the fences. Focus on your work and remain diligent.,unknown,2025-10-31 10:44:27
NPC,A melody may indeed help to pass the time more quickly while working. It is important to maintain a positive spirit.,serious,2025-10-31 10:44:27
player,A melody may indeed help to pass the time more quickly while working. It is important to maintain a positive spirit.,unknown,2025-10-31 10:44:42
NPC,"Indeed, a tune may assist. It does not make the work any lighter, but it certainly makes the time pass more quickly.",serious,2025-10-31 10:44:42
player,"Indeed, a tune may assist. It does not make the work any lighter, but it certainly makes the time pass more quickly.",unknown,2025-10-31 10:44:55
NPC,Certainly. I have been known to turn even chopping firewood into a drum solo. Would you like me to play something light while you work? I believe it could help establish a rhythm.,serious,2025-10-31 10:44:55
player,Certainly. I have been known to turn even chopping firewood into a drum solo. Would you like me to play something light while you work? I believe it could help establish a rhythm.,unknown,2025-10-31 10:45:08
NPC,"I appreciate the thought, but I focus better in silence. The rhythm is already established in my mind.",serious,2025-10-31 10:45:08
Shane,"Hello, how are you feeling today?",unknown,2025-10-31 11:05:53
Sam,"Greetings. I am in good spirits, thank you for inquiring. I have just finished practicing music for a while, as I often do. How are you faring?",serious,2025-10-31 11:05:53
Sam,"Greetings. I am in good spirits, thank you for inquiring. I have just finished practicing music for a while, as I often do. How are you faring?",unknown,2025-10-31 11:06:06
Shane,"Alright, I suppose. Just finished fixin' the fence. Nothin's ever done around here, though.",neutral,2025-10-31 11:06:06
Shane,"Alright, I suppose. Just finished fixin' the fence. Nothin's ever done around here, though.",unknown,2025-10-31 11:06:21
Sam,"The repairs to the fence are well done. It is likely that the structure has witnessed much over time. If you are able, consider taking a brief respite to play a few chords. It may offer some mental clarity.",serious,2025-10-31 11:06:21
Sam,"The repairs to the fence are well done. It is likely that the structure has witnessed much over time. If you are able, consider taking a brief respite to play a few chords. It may offer some mental clarity.",unknown,2025-10-31 11:06:33
Shane,The fence endured far worse storms. I'm uncertain if I have the energy to sit and perform tonight.,serious,2025-10-31 11:06:33
Shane,The fence endured far worse storms. I'm uncertain if I have the energy to sit and perform tonight.,unknown,2025-10-31 11:06:46
Sam,"I understand. There are days when the music comes effortlessly, and others when it does not. Perhaps strumming a few chords could help gauge how it feels.",serious,2025-10-31 11:06:46
Sam,"I understand. There are days when the music comes effortlessly, and others when it does not. Perhaps strumming a few chords could help gauge how it feels.",unknown,2025-10-31 11:07:00
Shane,"Music is akin to the weather; it arrives unpredictably, without regard for convenience or expectation. There seems little value in attempting to force its occurrence.",serious,2025-10-31 11:07:00
